{"schemaVersion":"1.0","kind":"linux-hardware-inventory","architecture":"x86_64","cpu":{"status":"complete","logicalProcessors":2,"vendors":["GenuineIntel"],"models":["Example CPU"],"virtualizationFlagPresent":true},"memory":{"status":"complete","totalBytes":16777216},"firmware":{"status":"complete","bootMode":"uefi","dmi":{"biosVendor":"Example BIOS","biosVersion":"1.2.3","boardName":"Example Board","boardVendor":"Example Vendor","productName":"Example Product","systemVendor":"Example System"}},"pci":{"status":"complete","devices":[{"class":"0x030000","vendorId":"0x1234","deviceId":"0x1111","count":1}]},"usb":{"status":"complete","devices":[{"class":"0x00","vendorId":"0x1d6b","productId":"0x0002","count":1}]}}
